{"budget_rule_version":"budget-v1","bundle_id":"53000000-0000-4000-8000-000000000001","canonicalization_version":"matching-rule-release-json-v1","components":[{"code":"interest","ordinal":1,"weight_bps":3000},{"code":"capability","ordinal":2,"weight_bps":2500},{"code":"availability","ordinal":3,"weight_bps":1500},{"code":"compensation","ordinal":4,"weight_bps":1500},{"code":"collaboration","ordinal":5,"weight_bps":1000},{"code":"evidence_trust","ordinal":6,"weight_bps":500}],"demand_type_code":"DEMAND.PROJECT","effective_at":"2020-01-01T00:00:00Z","effective_until":"2100-01-01T00:00:00Z","engine_artifact_sha256":"f00ca4864a86a90bec51e9f93e61da75c86016213942d416c604fcfe5fe6c79e","engine_identifier":"deterministic-matcher-v1","engine_major":1,"explanation_template_version":"explanation-v1","golden_vectors":[{"expected_result_sha256":"d98208bee84455d6b1961cca09a50f2d2768c4508cc6a2f6da767a23427d2eed","input_sha256":"e3db66e77abd82418d8fe8c55ed5abdd0da5246584cf32336473a8fd00b11a07","vector_id":"golden_budget_override_v1"},{"expected_result_sha256":"66959acdca956d034ee0c60fdb3e00096dabffb5465302aa788c7c4a7201ca22","input_sha256":"29b9f5d87987db36449860007f8c3d76867911d162d68cf54bebd92879ed5c5a","vector_id":"golden_excluded_filter_v1"},{"expected_result_sha256":"c67678ffc5aab7fd97aacd46f9850118307631bd107e84bee9236603989807af","input_sha256":"8b5728c841344476834fe4fadb30631f0931a43e20584a8d32dfd002f7912373","vector_id":"golden_same_score_tie_v1"}],"hard_filters":[{"code":"CREATOR_INACTIVE","enabled":true,"ordinal":1},{"code":"BOUNDARY_DOMAIN","enabled":true,"ordinal":2},{"code":"BOUNDARY_TASK","enabled":true,"ordinal":3},{"code":"MISSING_MUST_HAVE_SKILL","enabled":true,"ordinal":4},{"code":"DATE_CONFLICT","enabled":true,"ordinal":5},{"code":"CAPACITY_CONFLICT","enabled":true,"ordinal":6},{"code":"DURATION_CONFLICT","enabled":true,"ordinal":7},{"code":"CURRENCY_MISMATCH","enabled":true,"ordinal":8},{"code":"BELOW_PRIVATE_FLOOR","enabled":true,"ordinal":9},{"code":"DATA_POLICY_CONFLICT","enabled":true,"ordinal":10},{"code":"AI_POLICY_CONFLICT","enabled":true,"ordinal":11},{"code":"LANGUAGE_MISMATCH","enabled":true,"ordinal":12},{"code":"WORK_MODE_CONFLICT","enabled":true,"ordinal":13},{"code":"LOCATION_RESTRICTION","enabled":true,"ordinal":14},{"code":"CONFLICT_OF_INTEREST","enabled":true,"ordinal":15}],"invitation_limit":10,"jurisdiction_code":"JURISDICTION.CN","locale":"zh-CN","matching_rule_version":"matching-v1","reason_code_version":"reason-v1","schema_version":1,"selector_digest":"3bd2f51daac99e67e0da34eb15134ab3cc3a786c994899c5246fe33689179ead","semantic_version":"1.0.0","taxonomy_bundle_id":"50000000-0000-4000-8000-000000000001","taxonomy_family_code":"PLATFORM_WORK_V1"}
